<?xml version="1.0" encoding="UTF-8"?>
<?xml-stylesheet type="text/xsl" href="Candy.xsl"?>

<Candies xmlns:xsi="http://www.w3.org/2001/XMLSchema-instance" xsi:noNamespaceSchemaLocation="Candy.xsd">
    <Candy name="Candy1">
        <Energy>256</Energy>
        <Type>Iris</Type>
        <Ingredients>
            <Ingredient> 
                <Name>Water</Name>
                <Count>256</Count>
            </Ingredient>
            <Ingredient> 
                <Name>Sugar</Name>
                <Count>3</Count>
            </Ingredient>
            <Ingredient> 
                <Name>Fructose</Name>
                <Count>2</Count>
            </Ingredient>
            <Ingredient>
                <Name>Vanillin</Name>
                <Count>2</Count>
            </Ingredient>
        </Ingredients>
        <Value>
            <Proteins>3</Proteins>
            <Fats>2</Fats>
            <Carbohydrates>4</Carbohydrates>
        </Value>
        <Production>Roshen</Production>
    </Candy>
    
    <Candy name="Vyshnya">
        <Energy>512</Energy>
        <Type>Chocolate</Type>
        <Ingredients>
            <Ingredient> 
                <Name>Water</Name>
                <Count>18</Count>
            </Ingredient>
            <Ingredient> 
                <Name>Sugar</Name>
                <Count>1</Count>
            </Ingredient>
            <Ingredient> 
                <Name>Fructose</Name>
                <Count>2</Count>
            </Ingredient>
            <Ingredient>
                <Name>Vanillin</Name>
                <Count>3</Count>
            </Ingredient>
        </Ingredients>
        <Value>
            <Proteins>8</Proteins>
            <Fats>7</Fats>
            <Carbohydrates>6</Carbohydrates>
        </Value>
        <Production>Roshen</Production>
    </Candy>
</Candies>